[
  {
    "seq": 1,
    "statement_id": 201,
    "customer_code": "Be_rich_CCC",
    "bank_name": "Public Bank",
    "account_holder": "CHANG CHOON CHOW",
    "account_last4": "0727",
    "statement_date": "2025-01-25",
    "file_path": "static/uploads/customers/Be_rich_CCC/savings/Public_Bank/2025-01/CHANG_CHOON_CHOW_Public_Bank_0727_2025-01-25.pdf",
    "db_transaction_count": 31,
    "verified": false,
    "pdf_transaction_count": null,
    "match_status": null,
    "notes": ""
  },
  {
    "seq": 2,
    "statement_id": 202,
    "customer_code": "Be_rich_CCC",
    "bank_name": "Public Bank",
    "account_holder": "CHANG CHOON CHOW",
    "account_last4": "0727",
    "statement_date": "2025-02-25",
    "file_path": "static/uploads/customers/Be_rich_CCC/savings/Public_Bank/2025-02/CHANG_CHOON_CHOW_Public_Bank_0727_2025-02-25.pdf",
    "db_transaction_count": 35,
    "verified": false,
    "pdf_transaction_count": null,
    "match_status": null,
    "notes": ""
  },
  {
    "seq": 3,
    "statement_id": 203,
    "customer_code": "Be_rich_CCC",
    "bank_name": "Public Bank",
    "account_holder": "CHANG CHOON CHOW",
    "account_last4": "0727",
    "statement_date": "2025-03-25",
    "file_path": "static/uploads/customers/Be_rich_CCC/savings/Public_Bank/2025-03/CHANG_CHOON_CHOW_Public_Bank_0727_2025-03-25.pdf",
    "db_transaction_count": 40,
    "verified": false,
    "pdf_transaction_count": null,
    "match_status": null,
    "notes": ""
  },
  {
    "seq": 4,
    "statement_id": 204,
    "customer_code": "Be_rich_CCC",
    "bank_name": "Public Bank",
    "account_holder": "CHANG CHOON CHOW",
    "account_last4": "0727",
    "statement_date": "2025-04-25",
    "file_path": "static/uploads/customers/Be_rich_CCC/savings/Public_Bank/2025-04/CHANG_CHOON_CHOW_Public_Bank_0727_2025-04-25.pdf",
    "db_transaction_count": 32,
    "verified": false,
    "pdf_transaction_count": null,
    "match_status": null,
    "notes": ""
  },
  {
    "seq": 5,
    "statement_id": 205,
    "customer_code": "Be_rich_CCC",
    "bank_name": "Public Bank",
    "account_holder": "CHANG CHOON CHOW",
    "account_last4": "0727",
    "statement_date": "2025-05-25",
    "file_path": "static/uploads/customers/Be_rich_CCC/savings/Public_Bank/2025-05/CHANG_CHOON_CHOW_Public_Bank_0727_2025-05-25.pdf",
    "db_transaction_count": 32,
    "verified": false,
    "pdf_transaction_count": null,
    "match_status": null,
    "notes": ""
  },
  {
    "seq": 6,
    "statement_id": 206,
    "customer_code": "Be_rich_CCC",
    "bank_name": "Public Bank",
    "account_holder": "CHANG CHOON CHOW",
    "account_last4": "0727",
    "statement_date": "2025-06-25",
    "file_path": "static/uploads/customers/Be_rich_CCC/savings/Public_Bank/2025-06/CHANG_CHOON_CHOW_Public_Bank_0727_2025-06-25.pdf",
    "db_transaction_count": 18,
    "verified": false,
    "pdf_transaction_count": null,
    "match_status": null,
    "notes": ""
  },
  {
    "seq": 7,
    "statement_id": 344,
    "customer_code": "Be_rich_TYC&YCW",
    "bank_name": "OCBC",
    "account_holder": null,
    "account_last4": "1489",
    "statement_date": "2024-06-30",
    "file_path": "static/uploads/customers/Be_rich_TYC&YCW/savings/OCBC/2024-06/TYC&YCW_OCBC_1489_2024-06-30.pdf",
    "db_transaction_count": 5,
    "verified": false,
    "pdf_transaction_count": null,
    "match_status": null,
    "notes": ""
  },
  {
    "seq": 8,
    "statement_id": 345,
    "customer_code": "Be_rich_TYC&YCW",
    "bank_name": "OCBC",
    "account_holder": null,
    "account_last4": "1489",
    "statement_date": "2024-07-31",
    "file_path": "static/uploads/customers/Be_rich_TYC&YCW/savings/OCBC/2024-07/TYC&YCW_OCBC_1489_2024-07-31.pdf",
    "db_transaction_count": 2,
    "verified": false,
    "pdf_transaction_count": null,
    "match_status": null,
    "notes": ""
  },
  {
    "seq": 9,
    "statement_id": 346,
    "customer_code": "Be_rich_TYC&YCW",
    "bank_name": "OCBC",
    "account_holder": null,
    "account_last4": "1489",
    "statement_date": "2024-08-31",
    "file_path": "static/uploads/customers/Be_rich_TYC&YCW/savings/OCBC/2024-08/TYC&YCW_OCBC_1489_2024-08-31.pdf",
    "db_transaction_count": 0,
    "verified": false,
    "pdf_transaction_count": null,
    "match_status": null,
    "notes": ""
  },
  {
    "seq": 10,
    "statement_id": 347,
    "customer_code": "Be_rich_TYC&YCW",
    "bank_name": "OCBC",
    "account_holder": null,
    "account_last4": "1489",
    "statement_date": "2024-09-30",
    "file_path": "static/uploads/customers/Be_rich_TYC&YCW/savings/OCBC/2024-09/TYC&YCW_OCBC_1489_2024-09-30.pdf",
    "db_transaction_count": 0,
    "verified": false,
    "pdf_transaction_count": null,
    "match_status": null,
    "notes": ""
  },
  {
    "seq": 11,
    "statement_id": 348,
    "customer_code": "Be_rich_TYC&YCW",
    "bank_name": "OCBC",
    "account_holder": null,
    "account_last4": "1489",
    "statement_date": "2024-10-31",
    "file_path": "static/uploads/customers/Be_rich_TYC&YCW/savings/OCBC/2024-10/TYC&YCW_OCBC_1489_2024-10-31.pdf",
    "db_transaction_count": 4,
    "verified": false,
    "pdf_transaction_count": null,
    "match_status": null,
    "notes": ""
  },
  {
    "seq": 12,
    "statement_id": 349,
    "customer_code": "Be_rich_TYC&YCW",
    "bank_name": "OCBC",
    "account_holder": null,
    "account_last4": "1489",
    "statement_date": "2024-11-30",
    "file_path": "static/uploads/customers/Be_rich_TYC&YCW/savings/OCBC/2024-11/TYC&YCW_OCBC_1489_2024-11-30.pdf",
    "db_transaction_count": 1,
    "verified": false,
    "pdf_transaction_count": null,
    "match_status": null,
    "notes": ""
  },
  {
    "seq": 13,
    "statement_id": 350,
    "customer_code": "Be_rich_TYC&YCW",
    "bank_name": "OCBC",
    "account_holder": null,
    "account_last4": "1489",
    "statement_date": "2024-12-31",
    "file_path": "static/uploads/customers/Be_rich_TYC&YCW/savings/OCBC/2024-12/TYC&YCW_OCBC_1489_2024-12-31.pdf",
    "db_transaction_count": 3,
    "verified": false,
    "pdf_transaction_count": null,
    "match_status": null,
    "notes": ""
  },
  {
    "seq": 14,
    "statement_id": 351,
    "customer_code": "Be_rich_TYC&YCW",
    "bank_name": "OCBC",
    "account_holder": null,
    "account_last4": "1489",
    "statement_date": "2025-01-31",
    "file_path": "static/uploads/customers/Be_rich_TYC&YCW/savings/OCBC/2025-01/TYC&YCW_OCBC_1489_2025-01-31.pdf",
    "db_transaction_count": 8,
    "verified": false,
    "pdf_transaction_count": null,
    "match_status": null,
    "notes": ""
  },
  {
    "seq": 15,
    "statement_id": 352,
    "customer_code": "Be_rich_TYC&YCW",
    "bank_name": "OCBC",
    "account_holder": null,
    "account_last4": "1489",
    "statement_date": "2025-02-28",
    "file_path": "static/uploads/customers/Be_rich_TYC&YCW/savings/OCBC/2025-02/TYC&YCW_OCBC_1489_2025-02-28.pdf",
    "db_transaction_count": 1,
    "verified": false,
    "pdf_transaction_count": null,
    "match_status": null,
    "notes": ""
  },
  {
    "seq": 16,
    "statement_id": 353,
    "customer_code": "Be_rich_TYC&YCW",
    "bank_name": "OCBC",
    "account_holder": null,
    "account_last4": "1489",
    "statement_date": "2025-03-31",
    "file_path": "static/uploads/customers/Be_rich_TYC&YCW/savings/OCBC/2025-03/TYC&YCW_OCBC_1489_2025-03-31.pdf",
    "db_transaction_count": 1,
    "verified": false,
    "pdf_transaction_count": null,
    "match_status": null,
    "notes": ""
  },
  {
    "seq": 17,
    "statement_id": 354,
    "customer_code": "Be_rich_TYC&YCW",
    "bank_name": "OCBC",
    "account_holder": null,
    "account_last4": "1489",
    "statement_date": "2025-04-30",
    "file_path": "static/uploads/customers/Be_rich_TYC&YCW/savings/OCBC/2025-04/TYC&YCW_OCBC_1489_2025-04-30.pdf",
    "db_transaction_count": 2,
    "verified": false,
    "pdf_transaction_count": null,
    "match_status": null,
    "notes": ""
  },
  {
    "seq": 18,
    "statement_id": 355,
    "customer_code": "Be_rich_TYC&YCW",
    "bank_name": "OCBC",
    "account_holder": null,
    "account_last4": "1489",
    "statement_date": "2025-05-31",
    "file_path": "static/uploads/customers/Be_rich_TYC&YCW/savings/OCBC/2025-05/TYC&YCW_OCBC_1489_2025-05-31.pdf",
    "db_transaction_count": 0,
    "verified": false,
    "pdf_transaction_count": null,
    "match_status": null,
    "notes": ""
  },
  {
    "seq": 19,
    "statement_id": 356,
    "customer_code": "Be_rich_TYC&YCW",
    "bank_name": "OCBC",
    "account_holder": null,
    "account_last4": "1489",
    "statement_date": "2025-06-30",
    "file_path": "static/uploads/customers/Be_rich_TYC&YCW/savings/OCBC/2025-06/TYC&YCW_OCBC_1489_2025-06-30.pdf",
    "db_transaction_count": 7,
    "verified": false,
    "pdf_transaction_count": null,
    "match_status": null,
    "notes": ""
  },
  {
    "seq": 20,
    "statement_id": 357,
    "customer_code": "Be_rich_TYC&YCW",
    "bank_name": "OCBC",
    "account_holder": null,
    "account_last4": "1489",
    "statement_date": "2025-07-31",
    "file_path": "static/uploads/customers/Be_rich_TYC&YCW/savings/OCBC/2025-07/TYC&YCW_OCBC_1489_2025-07-31.pdf",
    "db_transaction_count": 9,
    "verified": false,
    "pdf_transaction_count": null,
    "match_status": null,
    "notes": ""
  },
  {
    "seq": 21,
    "statement_id": 359,
    "customer_code": "Be_rich_TYC&YCW",
    "bank_name": "OCBC",
    "account_holder": null,
    "account_last4": "1489",
    "statement_date": "2025-08-31",
    "file_path": "static/uploads/customers/Be_rich_TYC&YCW/savings/OCBC/2025-08/TYC&YCW_OCBC_1489_2025-08-31.pdf",
    "db_transaction_count": 14,
    "verified": false,
    "pdf_transaction_count": null,
    "match_status": null,
    "notes": ""
  },
  {
    "seq": 22,
    "statement_id": 358,
    "customer_code": "Be_rich_TYC&YCW",
    "bank_name": "OCBC",
    "account_holder": null,
    "account_last4": "1489",
    "statement_date": "2025-09-30",
    "file_path": "static/uploads/customers/Be_rich_TYC&YCW/savings/OCBC/2025-09/TYC&YCW_OCBC_1489_2025-09-30.pdf",
    "db_transaction_count": 5,
    "verified": false,
    "pdf_transaction_count": null,
    "match_status": null,
    "notes": ""
  },
  {
    "seq": 23,
    "statement_id": 186,
    "customer_code": "Be_rich_TZL",
    "bank_name": "GX Bank",
    "account_holder": "Tan Zee Liang",
    "account_last4": "8388",
    "statement_date": "2024-05-31",
    "file_path": "static/uploads/customers/Be_rich_TZL/savings/GX_Bank/2024-05/TAN_ZEE_LIANG_GX_Bank_8388_2024-05-31.pdf",
    "db_transaction_count": 23,
    "verified": false,
    "pdf_transaction_count": null,
    "match_status": null,
    "notes": ""
  },
  {
    "seq": 24,
    "statement_id": 187,
    "customer_code": "Be_rich_TZL",
    "bank_name": "GX Bank",
    "account_holder": "Tan Zee Liang",
    "account_last4": "8388",
    "statement_date": "2024-07-31",
    "file_path": "static/uploads/customers/Be_rich_TZL/savings/GX_Bank/2024-07/TAN_ZEE_LIANG_GX_Bank_8388_2024-07-31.pdf",
    "db_transaction_count": 85,
    "verified": false,
    "pdf_transaction_count": null,
    "match_status": null,
    "notes": ""
  },
  {
    "seq": 25,
    "statement_id": 188,
    "customer_code": "Be_rich_TZL",
    "bank_name": "GX Bank",
    "account_holder": "Tan Zee Liang",
    "account_last4": "8388",
    "statement_date": "2024-08-31",
    "file_path": "static/uploads/customers/Be_rich_TZL/savings/GX_Bank/2024-08/TAN_ZEE_LIANG_GX_Bank_8388_2024-08-31.pdf",
    "db_transaction_count": 134,
    "verified": false,
    "pdf_transaction_count": null,
    "match_status": null,
    "notes": ""
  },
  {
    "seq": 26,
    "statement_id": 189,
    "customer_code": "Be_rich_TZL",
    "bank_name": "GX Bank",
    "account_holder": "Tan Zee Liang",
    "account_last4": "8388",
    "statement_date": "2024-09-30",
    "file_path": "static/uploads/customers/Be_rich_TZL/savings/GX_Bank/2024-09/TAN_ZEE_LIANG_GX_Bank_8388_2024-09-30.pdf",
    "db_transaction_count": 137,
    "verified": false,
    "pdf_transaction_count": null,
    "match_status": null,
    "notes": ""
  },
  {
    "seq": 27,
    "statement_id": 190,
    "customer_code": "Be_rich_TZL",
    "bank_name": "GX Bank",
    "account_holder": "Tan Zee Liang",
    "account_last4": "8388",
    "statement_date": "2024-10-31",
    "file_path": "static/uploads/customers/Be_rich_TZL/savings/GX_Bank/2024-10/TAN_ZEE_LIANG_GX_Bank_8388_2024-10-31.pdf",
    "db_transaction_count": 169,
    "verified": false,
    "pdf_transaction_count": null,
    "match_status": null,
    "notes": ""
  },
  {
    "seq": 28,
    "statement_id": 191,
    "customer_code": "Be_rich_TZL",
    "bank_name": "GX Bank",
    "account_holder": "Tan Zee Liang",
    "account_last4": "8388",
    "statement_date": "2024-11-30",
    "file_path": "static/uploads/customers/Be_rich_TZL/savings/GX_Bank/2024-11/TAN_ZEE_LIANG_GX_Bank_8388_2024-11-30.pdf",
    "db_transaction_count": 121,
    "verified": false,
    "pdf_transaction_count": null,
    "match_status": null,
    "notes": ""
  },
  {
    "seq": 29,
    "statement_id": 192,
    "customer_code": "Be_rich_TZL",
    "bank_name": "GX Bank",
    "account_holder": "Tan Zee Liang",
    "account_last4": "8388",
    "statement_date": "2024-12-31",
    "file_path": "static/uploads/customers/Be_rich_TZL/savings/GX_Bank/2024-12/TAN_ZEE_LIANG_GX_Bank_8388_2024-12-31.pdf",
    "db_transaction_count": 134,
    "verified": false,
    "pdf_transaction_count": null,
    "match_status": null,
    "notes": ""
  },
  {
    "seq": 30,
    "statement_id": 193,
    "customer_code": "Be_rich_TZL",
    "bank_name": "GX Bank",
    "account_holder": "Tan Zee Liang",
    "account_last4": "8388",
    "statement_date": "2025-01-31",
    "file_path": "static/uploads/customers/Be_rich_TZL/savings/GX_Bank/2025-01/TAN_ZEE_LIANG_GX_Bank_8388_2025-01-31.pdf",
    "db_transaction_count": 196,
    "verified": false,
    "pdf_transaction_count": null,
    "match_status": null,
    "notes": ""
  },
  {
    "seq": 31,
    "statement_id": 194,
    "customer_code": "Be_rich_TZL",
    "bank_name": "GX Bank",
    "account_holder": "Tan Zee Liang",
    "account_last4": "8388",
    "statement_date": "2025-02-28",
    "file_path": "static/uploads/customers/Be_rich_TZL/savings/GX_Bank/2025-02/TAN_ZEE_LIANG_GX_Bank_8388_2025-02-28.pdf",
    "db_transaction_count": 154,
    "verified": false,
    "pdf_transaction_count": null,
    "match_status": null,
    "notes": ""
  },
  {
    "seq": 32,
    "statement_id": 195,
    "customer_code": "Be_rich_TZL",
    "bank_name": "GX Bank",
    "account_holder": "Tan Zee Liang",
    "account_last4": "8388",
    "statement_date": "2025-03-31",
    "file_path": "static/uploads/customers/Be_rich_TZL/savings/GX_Bank/2025-03/TAN_ZEE_LIANG_GX_Bank_8388_2025-03-31.pdf",
    "db_transaction_count": 148,
    "verified": false,
    "pdf_transaction_count": null,
    "match_status": null,
    "notes": ""
  },
  {
    "seq": 33,
    "statement_id": 196,
    "customer_code": "Be_rich_TZL",
    "bank_name": "GX Bank",
    "account_holder": "Tan Zee Liang",
    "account_last4": "8388",
    "statement_date": "2025-04-30",
    "file_path": "static/uploads/customers/Be_rich_TZL/savings/GX_Bank/2025-04/TAN_ZEE_LIANG_GX_Bank_8388_2025-04-30.pdf",
    "db_transaction_count": 125,
    "verified": false,
    "pdf_transaction_count": null,
    "match_status": null,
    "notes": ""
  },
  {
    "seq": 34,
    "statement_id": 197,
    "customer_code": "Be_rich_TZL",
    "bank_name": "GX Bank",
    "account_holder": "Tan Zee Liang",
    "account_last4": "8388",
    "statement_date": "2025-05-31",
    "file_path": "static/uploads/customers/Be_rich_TZL/savings/GX_Bank/2025-05/TAN_ZEE_LIANG_GX_Bank_8388_2025-05-31.pdf",
    "db_transaction_count": 85,
    "verified": false,
    "pdf_transaction_count": null,
    "match_status": null,
    "notes": ""
  },
  {
    "seq": 35,
    "statement_id": 198,
    "customer_code": "Be_rich_TZL",
    "bank_name": "GX Bank",
    "account_holder": "Tan Zee Liang",
    "account_last4": "8388",
    "statement_date": "2025-07-31",
    "file_path": "static/uploads/customers/Be_rich_TZL/savings/GX_Bank/2025-07/TAN_ZEE_LIANG_GX_Bank_8388_2025-07-31.pdf",
    "db_transaction_count": 9,
    "verified": false,
    "pdf_transaction_count": null,
    "match_status": null,
    "notes": ""
  },
  {
    "seq": 36,
    "statement_id": 199,
    "customer_code": "Be_rich_TZL",
    "bank_name": "GX Bank",
    "account_holder": "Tan Zee Liang",
    "account_last4": "8388",
    "statement_date": "2025-08-31",
    "file_path": "static/uploads/customers/Be_rich_TZL/savings/GX_Bank/2025-08/TAN_ZEE_LIANG_GX_Bank_8388_2025-08-31.pdf",
    "db_transaction_count": 1,
    "verified": false,
    "pdf_transaction_count": null,
    "match_status": null,
    "notes": ""
  },
  {
    "seq": 37,
    "statement_id": 200,
    "customer_code": "Be_rich_TZL",
    "bank_name": "GX Bank",
    "account_holder": "Tan Zee Liang",
    "account_last4": "8388",
    "statement_date": "2025-09-30",
    "file_path": "static/uploads/customers/Be_rich_TZL/savings/GX_Bank/2025-09/TAN_ZEE_LIANG_GX_Bank_8388_2025-09-30.pdf",
    "db_transaction_count": 6,
    "verified": false,
    "pdf_transaction_count": null,
    "match_status": null,
    "notes": ""
  },
  {
    "seq": 38,
    "statement_id": 208,
    "customer_code": "Be_rich_YCW",
    "bank_name": "GX Bank",
    "account_holder": "YEO CHEE WANG",
    "account_last4": "8373",
    "statement_date": "2024-07-31",
    "file_path": "static/uploads/customers/Be_rich_YCW/savings/GX_Bank/2024-07/YEO_CHEE_WANG_GX_Bank_8373_2024-07-31.pdf",
    "db_transaction_count": 7,
    "verified": false,
    "pdf_transaction_count": null,
    "match_status": null,
    "notes": ""
  },
  {
    "seq": 39,
    "statement_id": 209,
    "customer_code": "Be_rich_YCW",
    "bank_name": "GX Bank",
    "account_holder": "YEO CHEE WANG",
    "account_last4": "8373",
    "statement_date": "2024-08-31",
    "file_path": "static/uploads/customers/Be_rich_YCW/savings/GX_Bank/2024-08/YEO_CHEE_WANG_GX_Bank_8373_2024-08-31.pdf",
    "db_transaction_count": 71,
    "verified": false,
    "pdf_transaction_count": null,
    "match_status": null,
    "notes": ""
  },
  {
    "seq": 40,
    "statement_id": 210,
    "customer_code": "Be_rich_YCW",
    "bank_name": "GX Bank",
    "account_holder": "YEO CHEE WANG",
    "account_last4": "8373",
    "statement_date": "2024-09-30",
    "file_path": "static/uploads/customers/Be_rich_YCW/savings/GX_Bank/2024-09/YEO_CHEE_WANG_GX_Bank_8373_2024-09-30.pdf",
    "db_transaction_count": 67,
    "verified": false,
    "pdf_transaction_count": null,
    "match_status": null,
    "notes": ""
  },
  {
    "seq": 41,
    "statement_id": 211,
    "customer_code": "Be_rich_YCW",
    "bank_name": "GX Bank",
    "account_holder": "YEO CHEE WANG",
    "account_last4": "8373",
    "statement_date": "2024-10-31",
    "file_path": "static/uploads/customers/Be_rich_YCW/savings/GX_Bank/2024-10/YEO_CHEE_WANG_GX_Bank_8373_2024-10-31.pdf",
    "db_transaction_count": 90,
    "verified": false,
    "pdf_transaction_count": null,
    "match_status": null,
    "notes": ""
  },
  {
    "seq": 42,
    "statement_id": 212,
    "customer_code": "Be_rich_YCW",
    "bank_name": "GX Bank",
    "account_holder": "YEO CHEE WANG",
    "account_last4": "8373",
    "statement_date": "2024-11-30",
    "file_path": "static/uploads/customers/Be_rich_YCW/savings/GX_Bank/2024-11/YEO_CHEE_WANG_GX_Bank_8373_2024-11-30.pdf",
    "db_transaction_count": 67,
    "verified": false,
    "pdf_transaction_count": null,
    "match_status": null,
    "notes": ""
  },
  {
    "seq": 43,
    "statement_id": 213,
    "customer_code": "Be_rich_YCW",
    "bank_name": "GX Bank",
    "account_holder": "YEO CHEE WANG",
    "account_last4": "8373",
    "statement_date": "2024-12-31",
    "file_path": "static/uploads/customers/Be_rich_YCW/savings/GX_Bank/2024-12/YEO_CHEE_WANG_GX_Bank_8373_2024-12-31.pdf",
    "db_transaction_count": 90,
    "verified": false,
    "pdf_transaction_count": null,
    "match_status": null,
    "notes": ""
  },
  {
    "seq": 44,
    "statement_id": 306,
    "customer_code": "Be_rich_YCW",
    "bank_name": "GX Bank",
    "account_holder": "YEO CHEE WANG",
    "account_last4": "8373",
    "statement_date": "2025-08-31",
    "file_path": "static/uploads/customers/Be_rich_YCW/savings/GX_Bank/2025-08/YEO_CHEE_WANG_GX_Bank_8373_2025-08-31.pdf",
    "db_transaction_count": 92,
    "verified": false,
    "pdf_transaction_count": null,
    "match_status": null,
    "notes": ""
  },
  {
    "seq": 45,
    "statement_id": 307,
    "customer_code": "Be_rich_YCW",
    "bank_name": "GX Bank",
    "account_holder": "YEO CHEE WANG",
    "account_last4": "8373",
    "statement_date": "2025-09-30",
    "file_path": "static/uploads/customers/Be_rich_YCW/savings/GX_Bank/2025-09/YEO_CHEE_WANG_GX_Bank_8373_2025-09-30.pdf",
    "db_transaction_count": 83,
    "verified": false,
    "pdf_transaction_count": null,
    "match_status": null,
    "notes": ""
  },
  {
    "seq": 46,
    "statement_id": 217,
    "customer_code": "Be_rich_YCW",
    "bank_name": "GX Bank",
    "account_holder": "YEO CHEE WANG",
    "account_last4": "8373",
    "statement_date": "Apr 2025",
    "file_path": "static/uploads/customers/Be_rich_YCW/savings/GX_Bank/2025-01/YEO_CHEE_WANG_GX_Bank_8373_Apr-2025.pdf",
    "db_transaction_count": 134,
    "verified": false,
    "pdf_transaction_count": null,
    "match_status": null,
    "notes": ""
  },
  {
    "seq": 47,
    "statement_id": 215,
    "customer_code": "Be_rich_YCW",
    "bank_name": "GX Bank",
    "account_holder": "YEO CHEE WANG",
    "account_last4": "8373",
    "statement_date": "Feb 2025",
    "file_path": "static/uploads/customers/Be_rich_YCW/savings/GX_Bank/2025-01/YEO_CHEE_WANG_GX_Bank_8373_Feb-2025.pdf",
    "db_transaction_count": 84,
    "verified": false,
    "pdf_transaction_count": null,
    "match_status": null,
    "notes": ""
  },
  {
    "seq": 48,
    "statement_id": 214,
    "customer_code": "Be_rich_YCW",
    "bank_name": "GX Bank",
    "account_holder": "YEO CHEE WANG",
    "account_last4": "8373",
    "statement_date": "Jan 2025",
    "file_path": "static/uploads/customers/Be_rich_YCW/savings/GX_Bank/2025-01/YEO_CHEE_WANG_GX_Bank_8373_Jan-2025.pdf",
    "db_transaction_count": 131,
    "verified": false,
    "pdf_transaction_count": null,
    "match_status": null,
    "notes": ""
  },
  {
    "seq": 49,
    "statement_id": 220,
    "customer_code": "Be_rich_YCW",
    "bank_name": "GX Bank",
    "account_holder": "YEO CHEE WANG",
    "account_last4": "8373",
    "statement_date": "Jul 2025",
    "file_path": "static/uploads/customers/Be_rich_YCW/savings/GX_Bank/2025-01/YEO_CHEE_WANG_GX_Bank_8373_Jul-2025.pdf",
    "db_transaction_count": 132,
    "verified": false,
    "pdf_transaction_count": null,
    "match_status": null,
    "notes": ""
  },
  {
    "seq": 50,
    "statement_id": 219,
    "customer_code": "Be_rich_YCW",
    "bank_name": "GX Bank",
    "account_holder": "YEO CHEE WANG",
    "account_last4": "8373",
    "statement_date": "Jun 2025",
    "file_path": "static/uploads/customers/Be_rich_YCW/savings/GX_Bank/2025-01/YEO_CHEE_WANG_GX_Bank_8373_Jun-2025.pdf",
    "db_transaction_count": 116,
    "verified": false,
    "pdf_transaction_count": null,
    "match_status": null,
    "notes": ""
  },
  {
    "seq": 51,
    "statement_id": 216,
    "customer_code": "Be_rich_YCW",
    "bank_name": "GX Bank",
    "account_holder": "YEO CHEE WANG",
    "account_last4": "8373",
    "statement_date": "Mar 2025",
    "file_path": "static/uploads/customers/Be_rich_YCW/savings/GX_Bank/2025-01/YEO_CHEE_WANG_GX_Bank_8373_Mar-2025.pdf",
    "db_transaction_count": 92,
    "verified": false,
    "pdf_transaction_count": null,
    "match_status": null,
    "notes": ""
  },
  {
    "seq": 52,
    "statement_id": 218,
    "customer_code": "Be_rich_YCW",
    "bank_name": "GX Bank",
    "account_holder": "YEO CHEE WANG",
    "account_last4": "8373",
    "statement_date": "May 2025",
    "file_path": "static/uploads/customers/Be_rich_YCW/savings/GX_Bank/2025-01/YEO_CHEE_WANG_GX_Bank_8373_May-2025.pdf",
    "db_transaction_count": 162,
    "verified": false,
    "pdf_transaction_count": null,
    "match_status": null,
    "notes": ""
  },
  {
    "seq": 53,
    "statement_id": 325,
    "customer_code": "Be_rich_YCW",
    "bank_name": "OCBC",
    "account_holder": "YEO CHEE WANG",
    "account_last4": "1484",
    "statement_date": "2024-01-31",
    "file_path": "static/uploads/customers/Be_rich_YCW/savings/OCBC/2024-01/YEO_CHEE_WANG_OCBC_1484_2024-01-31.pdf",
    "db_transaction_count": 4,
    "verified": false,
    "pdf_transaction_count": null,
    "match_status": null,
    "notes": ""
  },
  {
    "seq": 54,
    "statement_id": 326,
    "customer_code": "Be_rich_YCW",
    "bank_name": "OCBC",
    "account_holder": "YEO CHEE WANG",
    "account_last4": "1484",
    "statement_date": "2024-02-29",
    "file_path": "static/uploads/customers/Be_rich_YCW/savings/OCBC/2024-02/YEO_CHEE_WANG_OCBC_1484_2024-02-29.pdf",
    "db_transaction_count": 3,
    "verified": false,
    "pdf_transaction_count": null,
    "match_status": null,
    "notes": ""
  },
  {
    "seq": 55,
    "statement_id": 327,
    "customer_code": "Be_rich_YCW",
    "bank_name": "OCBC",
    "account_holder": "YEO CHEE WANG",
    "account_last4": "1484",
    "statement_date": "2024-03-31",
    "file_path": "static/uploads/customers/Be_rich_YCW/savings/OCBC/2024-03/YEO_CHEE_WANG_OCBC_1484_2024-03-31.pdf",
    "db_transaction_count": 0,
    "verified": false,
    "pdf_transaction_count": null,
    "match_status": null,
    "notes": ""
  },
  {
    "seq": 56,
    "statement_id": 328,
    "customer_code": "Be_rich_YCW",
    "bank_name": "OCBC",
    "account_holder": "YEO CHEE WANG",
    "account_last4": "1484",
    "statement_date": "2024-04-30",
    "file_path": "static/uploads/customers/Be_rich_YCW/savings/OCBC/2024-04/YEO_CHEE_WANG_OCBC_1484_2024-04-30.pdf",
    "db_transaction_count": 9,
    "verified": false,
    "pdf_transaction_count": null,
    "match_status": null,
    "notes": ""
  },
  {
    "seq": 57,
    "statement_id": 329,
    "customer_code": "Be_rich_YCW",
    "bank_name": "OCBC",
    "account_holder": "YEO CHEE WANG",
    "account_last4": "1484",
    "statement_date": "2024-05-31",
    "file_path": "static/uploads/customers/Be_rich_YCW/savings/OCBC/2024-05/YEO_CHEE_WANG_OCBC_1484_2024-05-31.pdf",
    "db_transaction_count": 3,
    "verified": false,
    "pdf_transaction_count": null,
    "match_status": null,
    "notes": ""
  },
  {
    "seq": 58,
    "statement_id": 330,
    "customer_code": "Be_rich_YCW",
    "bank_name": "OCBC",
    "account_holder": "YEO CHEE WANG",
    "account_last4": "1484",
    "statement_date": "2024-06-30",
    "file_path": "static/uploads/customers/Be_rich_YCW/savings/OCBC/2024-06/YEO_CHEE_WANG_OCBC_1484_2024-06-30.pdf",
    "db_transaction_count": 3,
    "verified": false,
    "pdf_transaction_count": null,
    "match_status": null,
    "notes": ""
  },
  {
    "seq": 59,
    "statement_id": 331,
    "customer_code": "Be_rich_YCW",
    "bank_name": "OCBC",
    "account_holder": "YEO CHEE WANG",
    "account_last4": "1484",
    "statement_date": "2024-07-31",
    "file_path": "static/uploads/customers/Be_rich_YCW/savings/OCBC/2024-07/YEO_CHEE_WANG_OCBC_1484_2024-07-31.pdf",
    "db_transaction_count": 2,
    "verified": false,
    "pdf_transaction_count": null,
    "match_status": null,
    "notes": ""
  },
  {
    "seq": 60,
    "statement_id": 332,
    "customer_code": "Be_rich_YCW",
    "bank_name": "OCBC",
    "account_holder": "YEO CHEE WANG",
    "account_last4": "1484",
    "statement_date": "2024-08-31",
    "file_path": "static/uploads/customers/Be_rich_YCW/savings/OCBC/2024-08/YEO_CHEE_WANG_OCBC_1484_2024-08-31.pdf",
    "db_transaction_count": 9,
    "verified": false,
    "pdf_transaction_count": null,
    "match_status": null,
    "notes": ""
  },
  {
    "seq": 61,
    "statement_id": 333,
    "customer_code": "Be_rich_YCW",
    "bank_name": "OCBC",
    "account_holder": "YEO CHEE WANG",
    "account_last4": "1484",
    "statement_date": "2024-09-30",
    "file_path": "static/uploads/customers/Be_rich_YCW/savings/OCBC/2024-09/YEO_CHEE_WANG_OCBC_1484_2024-09-30.pdf",
    "db_transaction_count": 7,
    "verified": false,
    "pdf_transaction_count": null,
    "match_status": null,
    "notes": ""
  },
  {
    "seq": 62,
    "statement_id": 334,
    "customer_code": "Be_rich_YCW",
    "bank_name": "OCBC",
    "account_holder": "YEO CHEE WANG",
    "account_last4": "1484",
    "statement_date": "2024-10-31",
    "file_path": "static/uploads/customers/Be_rich_YCW/savings/OCBC/2024-10/YEO_CHEE_WANG_OCBC_1484_2024-10-31.pdf",
    "db_transaction_count": 3,
    "verified": false,
    "pdf_transaction_count": null,
    "match_status": null,
    "notes": ""
  },
  {
    "seq": 63,
    "statement_id": 335,
    "customer_code": "Be_rich_YCW",
    "bank_name": "OCBC",
    "account_holder": "YEO CHEE WANG",
    "account_last4": "1484",
    "statement_date": "2024-11-30",
    "file_path": "static/uploads/customers/Be_rich_YCW/savings/OCBC/2024-11/YEO_CHEE_WANG_OCBC_1484_2024-11-30.pdf",
    "db_transaction_count": 2,
    "verified": false,
    "pdf_transaction_count": null,
    "match_status": null,
    "notes": ""
  },
  {
    "seq": 64,
    "statement_id": 336,
    "customer_code": "Be_rich_YCW",
    "bank_name": "OCBC",
    "account_holder": "YEO CHEE WANG",
    "account_last4": "1484",
    "statement_date": "2024-12-31",
    "file_path": "static/uploads/customers/Be_rich_YCW/savings/OCBC/2024-12/YEO_CHEE_WANG_OCBC_1484_2024-12-31.pdf",
    "db_transaction_count": 2,
    "verified": false,
    "pdf_transaction_count": null,
    "match_status": null,
    "notes": ""
  },
  {
    "seq": 65,
    "statement_id": 253,
    "customer_code": "Be_rich_YCW",
    "bank_name": "OCBC",
    "account_holder": "YEO CHEE WANG",
    "account_last4": "1484",
    "statement_date": "2025-01-31",
    "file_path": "static/uploads/customers/Be_rich_YCW/savings/OCBC/2025-01/YEO_CHEE_WANG_OCBC_1484_2025-01-31.pdf",
    "db_transaction_count": 1,
    "verified": false,
    "pdf_transaction_count": null,
    "match_status": null,
    "notes": ""
  },
  {
    "seq": 66,
    "statement_id": 254,
    "customer_code": "Be_rich_YCW",
    "bank_name": "OCBC",
    "account_holder": "YEO CHEE WANG",
    "account_last4": "1484",
    "statement_date": "2025-02-28",
    "file_path": "static/uploads/customers/Be_rich_YCW/savings/OCBC/2025-02/YEO_CHEE_WANG_OCBC_1484_2025-02-28.pdf",
    "db_transaction_count": 2,
    "verified": false,
    "pdf_transaction_count": null,
    "match_status": null,
    "notes": ""
  },
  {
    "seq": 67,
    "statement_id": 255,
    "customer_code": "Be_rich_YCW",
    "bank_name": "OCBC",
    "account_holder": "YEO CHEE WANG",
    "account_last4": "1484",
    "statement_date": "2025-03-31",
    "file_path": "static/uploads/customers/Be_rich_YCW/savings/OCBC/2025-03/YEO_CHEE_WANG_OCBC_1484_2025-03-31.pdf",
    "db_transaction_count": 1,
    "verified": false,
    "pdf_transaction_count": null,
    "match_status": null,
    "notes": ""
  },
  {
    "seq": 68,
    "statement_id": 256,
    "customer_code": "Be_rich_YCW",
    "bank_name": "OCBC",
    "account_holder": "YEO CHEE WANG",
    "account_last4": "1484",
    "statement_date": "2025-04-30",
    "file_path": "static/uploads/customers/Be_rich_YCW/savings/OCBC/2025-04/YEO_CHEE_WANG_OCBC_1484_2025-04-30.pdf",
    "db_transaction_count": 2,
    "verified": false,
    "pdf_transaction_count": null,
    "match_status": null,
    "notes": ""
  },
  {
    "seq": 69,
    "statement_id": 257,
    "customer_code": "Be_rich_YCW",
    "bank_name": "OCBC",
    "account_holder": "YEO CHEE WANG",
    "account_last4": "1484",
    "statement_date": "2025-05-31",
    "file_path": "static/uploads/customers/Be_rich_YCW/savings/OCBC/2025-05/YEO_CHEE_WANG_OCBC_1484_2025-05-31.pdf",
    "db_transaction_count": 8,
    "verified": false,
    "pdf_transaction_count": null,
    "match_status": null,
    "notes": ""
  },
  {
    "seq": 70,
    "statement_id": 258,
    "customer_code": "Be_rich_YCW",
    "bank_name": "OCBC",
    "account_holder": "YEO CHEE WANG",
    "account_last4": "1484",
    "statement_date": "2025-06-30",
    "file_path": "static/uploads/customers/Be_rich_YCW/savings/OCBC/2025-06/YEO_CHEE_WANG_OCBC_1484_2025-06-30.pdf",
    "db_transaction_count": 12,
    "verified": false,
    "pdf_transaction_count": null,
    "match_status": null,
    "notes": ""
  },
  {
    "seq": 71,
    "statement_id": 259,
    "customer_code": "Be_rich_YCW",
    "bank_name": "OCBC",
    "account_holder": "YEO CHEE WANG",
    "account_last4": "1484",
    "statement_date": "2025-07-31",
    "file_path": "static/uploads/customers/Be_rich_YCW/savings/OCBC/2025-07/YEO_CHEE_WANG_OCBC_1484_2025-07-31.pdf",
    "db_transaction_count": 1,
    "verified": false,
    "pdf_transaction_count": null,
    "match_status": null,
    "notes": ""
  },
  {
    "seq": 72,
    "statement_id": 113,
    "customer_code": "Be_rich_YCW",
    "bank_name": "UOB",
    "account_holder": "YEO CHEE WANG",
    "account_last4": "1842",
    "statement_date": "2025-04-30",
    "file_path": "static/uploads/customers/Be_rich_YCW/savings/UOB/2025-04/YEO_CHEE_WANG_UOB_1842_2025-04-30.pdf",
    "db_transaction_count": 47,
    "verified": false,
    "pdf_transaction_count": null,
    "match_status": null,
    "notes": ""
  },
  {
    "seq": 73,
    "statement_id": 114,
    "customer_code": "Be_rich_YCW",
    "bank_name": "UOB",
    "account_holder": "YEO CHEE WANG",
    "account_last4": "1842",
    "statement_date": "2025-05-31",
    "file_path": "static/uploads/customers/Be_rich_YCW/savings/UOB/2025-05/YEO_CHEE_WANG_UOB_1842_2025-05-31.pdf",
    "db_transaction_count": 22,
    "verified": false,
    "pdf_transaction_count": null,
    "match_status": null,
    "notes": ""
  },
  {
    "seq": 74,
    "statement_id": 115,
    "customer_code": "Be_rich_YCW",
    "bank_name": "UOB",
    "account_holder": "YEO CHEE WANG",
    "account_last4": "1842",
    "statement_date": "2025-06-30",
    "file_path": "static/uploads/customers/Be_rich_YCW/savings/UOB/2025-06/YEO_CHEE_WANG_UOB_1842_2025-06-30.pdf",
    "db_transaction_count": 27,
    "verified": false,
    "pdf_transaction_count": null,
    "match_status": null,
    "notes": ""
  },
  {
    "seq": 75,
    "statement_id": 116,
    "customer_code": "Be_rich_YCW",
    "bank_name": "UOB",
    "account_holder": "YEO CHEE WANG",
    "account_last4": "1842",
    "statement_date": "2025-07-31",
    "file_path": "static/uploads/customers/Be_rich_YCW/savings/UOB/2025-07/YEO_CHEE_WANG_UOB_1842_2025-07-31.pdf",
    "db_transaction_count": 37,
    "verified": false,
    "pdf_transaction_count": null,
    "match_status": null,
    "notes": ""
  },
  {
    "seq": 76,
    "statement_id": 308,
    "customer_code": "Be_rich_YCW",
    "bank_name": "UOB",
    "account_holder": "YEO CHEE WANG",
    "account_last4": "1842",
    "statement_date": "2025-08-31",
    "file_path": "static/uploads/customers/Be_rich_YCW/savings/UOB/2025-08/YEO_CHEE_WANG_UOB_1842_2025-08-31.pdf",
    "db_transaction_count": 25,
    "verified": false,
    "pdf_transaction_count": null,
    "match_status": null,
    "notes": ""
  },
  {
    "seq": 77,
    "statement_id": 309,
    "customer_code": "Be_rich_YCW",
    "bank_name": "UOB",
    "account_holder": "YEO CHEE WANG",
    "account_last4": "1842",
    "statement_date": "2025-09-30",
    "file_path": "static/uploads/customers/Be_rich_YCW/savings/UOB/2025-09/YEO_CHEE_WANG_UOB_1842_2025-09-30.pdf",
    "db_transaction_count": 14,
    "verified": false,
    "pdf_transaction_count": null,
    "match_status": null,
    "notes": ""
  },
  {
    "seq": 78,
    "statement_id": 260,
    "customer_code": "CORP20251030054640",
    "bank_name": "Hong Leong Bank",
    "account_holder": "INFINITE GZ SDN. BHD.",
    "account_last4": "4645",
    "statement_date": "05-01-2025",
    "file_path": "static/uploads/customers/CORP20251030054640/savings/Hong_Leong_Bank/2025-01/INFINITE_GZ_Hong_Leong_Bank_4645_2025-01-05.pdf",
    "db_transaction_count": 30,
    "verified": false,
    "pdf_transaction_count": null,
    "match_status": null,
    "notes": ""
  },
  {
    "seq": 79,
    "statement_id": 261,
    "customer_code": "CORP20251030054640",
    "bank_name": "Hong Leong Bank",
    "account_holder": "INFINITE GZ SDN. BHD.",
    "account_last4": "4645",
    "statement_date": "05-02-2025",
    "file_path": "static/uploads/customers/CORP20251030054640/savings/Hong_Leong_Bank/2025-02/INFINITE_GZ_Hong_Leong_Bank_4645_2025-02-05.pdf",
    "db_transaction_count": 27,
    "verified": false,
    "pdf_transaction_count": null,
    "match_status": null,
    "notes": ""
  },
  {
    "seq": 80,
    "statement_id": 262,
    "customer_code": "CORP20251030054640",
    "bank_name": "Hong Leong Bank",
    "account_holder": "INFINITE GZ SDN. BHD.",
    "account_last4": "4645",
    "statement_date": "05-03-2025",
    "file_path": "static/uploads/customers/CORP20251030054640/savings/Hong_Leong_Bank/2025-03/INFINITE_GZ_Hong_Leong_Bank_4645_2025-03-05.pdf",
    "db_transaction_count": 28,
    "verified": false,
    "pdf_transaction_count": null,
    "match_status": null,
    "notes": ""
  },
  {
    "seq": 81,
    "statement_id": 263,
    "customer_code": "CORP20251030054640",
    "bank_name": "Hong Leong Bank",
    "account_holder": "INFINITE GZ SDN. BHD.",
    "account_last4": "4645",
    "statement_date": "05-04-2025",
    "file_path": "static/uploads/customers/CORP20251030054640/savings/Hong_Leong_Bank/2025-04/INFINITE_GZ_Hong_Leong_Bank_4645_2025-04-05.pdf",
    "db_transaction_count": 71,
    "verified": false,
    "pdf_transaction_count": null,
    "match_status": null,
    "notes": ""
  },
  {
    "seq": 82,
    "statement_id": 264,
    "customer_code": "CORP20251030054640",
    "bank_name": "Hong Leong Bank",
    "account_holder": "INFINITE GZ SDN. BHD.",
    "account_last4": "4645",
    "statement_date": "05-05-2025",
    "file_path": "static/uploads/customers/CORP20251030054640/savings/Hong_Leong_Bank/2025-05/INFINITE_GZ_Hong_Leong_Bank_4645_2025-05-05.pdf",
    "db_transaction_count": 59,
    "verified": false,
    "pdf_transaction_count": null,
    "match_status": null,
    "notes": ""
  },
  {
    "seq": 83,
    "statement_id": 265,
    "customer_code": "CORP20251030054640",
    "bank_name": "Hong Leong Bank",
    "account_holder": "INFINITE GZ SDN. BHD.",
    "account_last4": "4645",
    "statement_date": "05-06-2025",
    "file_path": "static/uploads/customers/CORP20251030054640/savings/Hong_Leong_Bank/2025-06/INFINITE_GZ_Hong_Leong_Bank_4645_2025-06-05.pdf",
    "db_transaction_count": 77,
    "verified": false,
    "pdf_transaction_count": null,
    "match_status": null,
    "notes": ""
  },
  {
    "seq": 84,
    "statement_id": 266,
    "customer_code": "CORP20251030054640",
    "bank_name": "Hong Leong Bank",
    "account_holder": "INFINITE GZ SDN. BHD.",
    "account_last4": "4645",
    "statement_date": "05-07-2024",
    "file_path": "static/uploads/customers/CORP20251030054640/savings/Hong_Leong_Bank/2024-07/INFINITE_GZ_Hong_Leong_Bank_4645_2024-07-05.pdf",
    "db_transaction_count": 2,
    "verified": false,
    "pdf_transaction_count": null,
    "match_status": null,
    "notes": ""
  },
  {
    "seq": 85,
    "statement_id": 267,
    "customer_code": "CORP20251030054640",
    "bank_name": "Hong Leong Bank",
    "account_holder": "INFINITE GZ SDN. BHD.",
    "account_last4": "4645",
    "statement_date": "05-07-2025",
    "file_path": "static/uploads/customers/CORP20251030054640/savings/Hong_Leong_Bank/2025-07/INFINITE_GZ_Hong_Leong_Bank_4645_2025-07-05.pdf",
    "db_transaction_count": 16,
    "verified": false,
    "pdf_transaction_count": null,
    "match_status": null,
    "notes": ""
  },
  {
    "seq": 86,
    "statement_id": 268,
    "customer_code": "CORP20251030054640",
    "bank_name": "Hong Leong Bank",
    "account_holder": "INFINITE GZ SDN. BHD.",
    "account_last4": "4645",
    "statement_date": "05-08-2024",
    "file_path": "static/uploads/customers/CORP20251030054640/savings/Hong_Leong_Bank/2024-08/INFINITE_GZ_Hong_Leong_Bank_4645_2024-08-05.pdf",
    "db_transaction_count": 10,
    "verified": false,
    "pdf_transaction_count": null,
    "match_status": null,
    "notes": ""
  },
  {
    "seq": 87,
    "statement_id": 269,
    "customer_code": "CORP20251030054640",
    "bank_name": "Hong Leong Bank",
    "account_holder": "INFINITE GZ SDN. BHD.",
    "account_last4": "4645",
    "statement_date": "05-08-2025",
    "file_path": "static/uploads/customers/CORP20251030054640/savings/Hong_Leong_Bank/2025-08/INFINITE_GZ_Hong_Leong_Bank_4645_2025-08-05.pdf",
    "db_transaction_count": 48,
    "verified": false,
    "pdf_transaction_count": null,
    "match_status": null,
    "notes": ""
  },
  {
    "seq": 88,
    "statement_id": 270,
    "customer_code": "CORP20251030054640",
    "bank_name": "Hong Leong Bank",
    "account_holder": "INFINITE GZ SDN. BHD.",
    "account_last4": "4645",
    "statement_date": "05-09-2024",
    "file_path": "static/uploads/customers/CORP20251030054640/savings/Hong_Leong_Bank/2024-09/INFINITE_GZ_Hong_Leong_Bank_4645_2024-09-05.pdf",
    "db_transaction_count": 44,
    "verified": false,
    "pdf_transaction_count": null,
    "match_status": null,
    "notes": ""
  },
  {
    "seq": 89,
    "statement_id": 271,
    "customer_code": "CORP20251030054640",
    "bank_name": "Hong Leong Bank",
    "account_holder": "INFINITE GZ SDN. BHD.",
    "account_last4": "4645",
    "statement_date": "05-09-2025",
    "file_path": "static/uploads/customers/CORP20251030054640/savings/Hong_Leong_Bank/2025-09/INFINITE_GZ_Hong_Leong_Bank_4645_2025-09-05.pdf",
    "db_transaction_count": 86,
    "verified": false,
    "pdf_transaction_count": null,
    "match_status": null,
    "notes": ""
  },
  {
    "seq": 90,
    "statement_id": 272,
    "customer_code": "CORP20251030054640",
    "bank_name": "Hong Leong Bank",
    "account_holder": "INFINITE GZ SDN. BHD.",
    "account_last4": "4645",
    "statement_date": "05-10-2024",
    "file_path": "static/uploads/customers/CORP20251030054640/savings/Hong_Leong_Bank/2024-10/INFINITE_GZ_Hong_Leong_Bank_4645_2024-10-05.pdf",
    "db_transaction_count": 40,
    "verified": false,
    "pdf_transaction_count": null,
    "match_status": null,
    "notes": ""
  },
  {
    "seq": 91,
    "statement_id": 273,
    "customer_code": "CORP20251030054640",
    "bank_name": "Hong Leong Bank",
    "account_holder": "INFINITE GZ SDN. BHD.",
    "account_last4": "4645",
    "statement_date": "05-10-2025",
    "file_path": "static/uploads/customers/CORP20251030054640/savings/Hong_Leong_Bank/2025-10/INFINITE_GZ_Hong_Leong_Bank_4645_2025-10-05.pdf",
    "db_transaction_count": 69,
    "verified": false,
    "pdf_transaction_count": null,
    "match_status": null,
    "notes": ""
  },
  {
    "seq": 92,
    "statement_id": 274,
    "customer_code": "CORP20251030054640",
    "bank_name": "Hong Leong Bank",
    "account_holder": "INFINITE GZ SDN. BHD.",
    "account_last4": "4645",
    "statement_date": "05-11-2024",
    "file_path": "static/uploads/customers/CORP20251030054640/savings/Hong_Leong_Bank/2024-11/INFINITE_GZ_Hong_Leong_Bank_4645_2024-11-05.pdf",
    "db_transaction_count": 46,
    "verified": false,
    "pdf_transaction_count": null,
    "match_status": null,
    "notes": ""
  },
  {
    "seq": 93,
    "statement_id": 275,
    "customer_code": "CORP20251030054640",
    "bank_name": "Hong Leong Bank",
    "account_holder": "INFINITE GZ SDN. BHD.",
    "account_last4": "4645",
    "statement_date": "05-12-2024",
    "file_path": "static/uploads/customers/CORP20251030054640/savings/Hong_Leong_Bank/2024-12/INFINITE_GZ_Hong_Leong_Bank_4645_2024-12-05.pdf",
    "db_transaction_count": 44,
    "verified": false,
    "pdf_transaction_count": null,
    "match_status": null,
    "notes": ""
  },
  {
    "seq": 94,
    "statement_id": 291,
    "customer_code": "CORP20251030061207",
    "bank_name": "Alliance Bank",
    "account_holder": "AI SMART TECH SDN. BHD.",
    "account_last4": "5540",
    "statement_date": "2024-11-30",
    "file_path": "static/uploads/customers/CORP20251030061207/savings/Alliance_Bank/2024-11/AI_SMART_TECH_Alliance_Bank_5540_2024-11-30.pdf",
    "db_transaction_count": 2,
    "verified": false,
    "pdf_transaction_count": null,
    "match_status": null,
    "notes": ""
  },
  {
    "seq": 95,
    "statement_id": 297,
    "customer_code": "CORP20251030061207",
    "bank_name": "Alliance Bank",
    "account_holder": "AI SMART TECH SDN. BHD.",
    "account_last4": "5540",
    "statement_date": "2024-12-31",
    "file_path": "static/uploads/customers/CORP20251030061207/savings/Alliance_Bank/2024-12/AI_SMART_TECH_Alliance_Bank_5540_2024-12-31.pdf",
    "db_transaction_count": 10,
    "verified": false,
    "pdf_transaction_count": null,
    "match_status": null,
    "notes": ""
  },
  {
    "seq": 96,
    "statement_id": 292,
    "customer_code": "CORP20251030061207",
    "bank_name": "Alliance Bank",
    "account_holder": "AI SMART TECH SDN. BHD.",
    "account_last4": "5540",
    "statement_date": "2025-01-31",
    "file_path": "static/uploads/customers/CORP20251030061207/savings/Alliance_Bank/2025-01/AI_SMART_TECH_Alliance_Bank_5540_2025-01-31.pdf",
    "db_transaction_count": 61,
    "verified": false,
    "pdf_transaction_count": null,
    "match_status": null,
    "notes": ""
  },
  {
    "seq": 97,
    "statement_id": 287,
    "customer_code": "CORP20251030061207",
    "bank_name": "Alliance Bank",
    "account_holder": "AI SMART TECH SDN. BHD.",
    "account_last4": "5540",
    "statement_date": "2025-02-28",
    "file_path": "static/uploads/customers/CORP20251030061207/savings/Alliance_Bank/2025-02/AI_SMART_TECH_Alliance_Bank_5540_2025-02-28.pdf",
    "db_transaction_count": 69,
    "verified": false,
    "pdf_transaction_count": null,
    "match_status": null,
    "notes": ""
  },
  {
    "seq": 98,
    "statement_id": 293,
    "customer_code": "CORP20251030061207",
    "bank_name": "Alliance Bank",
    "account_holder": "AI SMART TECH SDN. BHD.",
    "account_last4": "5540",
    "statement_date": "2025-03-31",
    "file_path": "static/uploads/customers/CORP20251030061207/savings/Alliance_Bank/2025-03/AI_SMART_TECH_Alliance_Bank_5540_2025-03-31.pdf",
    "db_transaction_count": 100,
    "verified": false,
    "pdf_transaction_count": null,
    "match_status": null,
    "notes": ""
  },
  {
    "seq": 99,
    "statement_id": 288,
    "customer_code": "CORP20251030061207",
    "bank_name": "Alliance Bank",
    "account_holder": "AI SMART TECH SDN. BHD.",
    "account_last4": "5540",
    "statement_date": "2025-04-30",
    "file_path": "static/uploads/customers/CORP20251030061207/savings/Alliance_Bank/2025-04/AI_SMART_TECH_Alliance_Bank_5540_2025-04-30.pdf",
    "db_transaction_count": 107,
    "verified": false,
    "pdf_transaction_count": null,
    "match_status": null,
    "notes": ""
  },
  {
    "seq": 100,
    "statement_id": 294,
    "customer_code": "CORP20251030061207",
    "bank_name": "Alliance Bank",
    "account_holder": "AI SMART TECH SDN. BHD.",
    "account_last4": "5540",
    "statement_date": "2025-05-31",
    "file_path": "static/uploads/customers/CORP20251030061207/savings/Alliance_Bank/2025-05/AI_SMART_TECH_Alliance_Bank_5540_2025-05-31.pdf",
    "db_transaction_count": 64,
    "verified": false,
    "pdf_transaction_count": null,
    "match_status": null,
    "notes": ""
  },
  {
    "seq": 101,
    "statement_id": 289,
    "customer_code": "CORP20251030061207",
    "bank_name": "Alliance Bank",
    "account_holder": "AI SMART TECH SDN. BHD.",
    "account_last4": "5540",
    "statement_date": "2025-06-30",
    "file_path": "static/uploads/customers/CORP20251030061207/savings/Alliance_Bank/2025-06/AI_SMART_TECH_Alliance_Bank_5540_2025-06-30.pdf",
    "db_transaction_count": 44,
    "verified": false,
    "pdf_transaction_count": null,
    "match_status": null,
    "notes": ""
  },
  {
    "seq": 102,
    "statement_id": 295,
    "customer_code": "CORP20251030061207",
    "bank_name": "Alliance Bank",
    "account_holder": "AI SMART TECH SDN. BHD.",
    "account_last4": "5540",
    "statement_date": "2025-07-31",
    "file_path": "static/uploads/customers/CORP20251030061207/savings/Alliance_Bank/2025-07/AI_SMART_TECH_Alliance_Bank_5540_2025-07-31.pdf",
    "db_transaction_count": 31,
    "verified": false,
    "pdf_transaction_count": null,
    "match_status": null,
    "notes": ""
  },
  {
    "seq": 103,
    "statement_id": 296,
    "customer_code": "CORP20251030061207",
    "bank_name": "Alliance Bank",
    "account_holder": "AI SMART TECH SDN. BHD.",
    "account_last4": "5540",
    "statement_date": "2025-08-31",
    "file_path": "static/uploads/customers/CORP20251030061207/savings/Alliance_Bank/2025-08/AI_SMART_TECH_Alliance_Bank_5540_2025-08-31.pdf",
    "db_transaction_count": 45,
    "verified": false,
    "pdf_transaction_count": null,
    "match_status": null,
    "notes": ""
  },
  {
    "seq": 104,
    "statement_id": 290,
    "customer_code": "CORP20251030061207",
    "bank_name": "Alliance Bank",
    "account_holder": "AI SMART TECH SDN. BHD.",
    "account_last4": "5540",
    "statement_date": "2025-09-30",
    "file_path": "static/uploads/customers/CORP20251030061207/savings/Alliance_Bank/2025-09/AI_SMART_TECH_Alliance_Bank_5540_2025-09-30.pdf",
    "db_transaction_count": 57,
    "verified": false,
    "pdf_transaction_count": null,
    "match_status": null,
    "notes": ""
  },
  {
    "seq": 105,
    "statement_id": 301,
    "customer_code": "CORP20251030061207",
    "bank_name": "Public Bank",
    "account_holder": "AI SMART TECH SDN. BHD.",
    "account_last4": "9009",
    "statement_date": "2025-03-31",
    "file_path": "static/uploads/customers/CORP20251030061207/savings/Public_Bank/2025-03/AI_SMART_TECH_Public_Bank_9009_2025-03-31.pdf",
    "db_transaction_count": 1,
    "verified": false,
    "pdf_transaction_count": null,
    "match_status": null,
    "notes": ""
  },
  {
    "seq": 106,
    "statement_id": 298,
    "customer_code": "CORP20251030061207",
    "bank_name": "Public Bank",
    "account_holder": "AI SMART TECH SDN. BHD.",
    "account_last4": "9009",
    "statement_date": "2025-04-30",
    "file_path": "static/uploads/customers/CORP20251030061207/savings/Public_Bank/2025-04/AI_SMART_TECH_Public_Bank_9009_2025-04-30.pdf",
    "db_transaction_count": 2,
    "verified": false,
    "pdf_transaction_count": null,
    "match_status": null,
    "notes": ""
  },
  {
    "seq": 107,
    "statement_id": 302,
    "customer_code": "CORP20251030061207",
    "bank_name": "Public Bank",
    "account_holder": "AI SMART TECH SDN. BHD.",
    "account_last4": "9009",
    "statement_date": "2025-05-31",
    "file_path": "static/uploads/customers/CORP20251030061207/savings/Public_Bank/2025-05/AI_SMART_TECH_Public_Bank_9009_2025-05-31.pdf",
    "db_transaction_count": 60,
    "verified": false,
    "pdf_transaction_count": null,
    "match_status": null,
    "notes": ""
  },
  {
    "seq": 108,
    "statement_id": 299,
    "customer_code": "CORP20251030061207",
    "bank_name": "Public Bank",
    "account_holder": "AI SMART TECH SDN. BHD.",
    "account_last4": "9009",
    "statement_date": "2025-06-30",
    "file_path": "static/uploads/customers/CORP20251030061207/savings/Public_Bank/2025-06/AI_SMART_TECH_Public_Bank_9009_2025-06-30.pdf",
    "db_transaction_count": 39,
    "verified": false,
    "pdf_transaction_count": null,
    "match_status": null,
    "notes": ""
  },
  {
    "seq": 109,
    "statement_id": 303,
    "customer_code": "CORP20251030061207",
    "bank_name": "Public Bank",
    "account_holder": "AI SMART TECH SDN. BHD.",
    "account_last4": "9009",
    "statement_date": "2025-07-31",
    "file_path": "static/uploads/customers/CORP20251030061207/savings/Public_Bank/2025-07/AI_SMART_TECH_Public_Bank_9009_2025-07-31.pdf",
    "db_transaction_count": 61,
    "verified": false,
    "pdf_transaction_count": null,
    "match_status": null,
    "notes": ""
  },
  {
    "seq": 110,
    "statement_id": 300,
    "customer_code": "CORP20251030061207",
    "bank_name": "Public Bank",
    "account_holder": "AI SMART TECH SDN. BHD.",
    "account_last4": "9009",
    "statement_date": "2025-08-31",
    "file_path": "static/uploads/customers/CORP20251030061207/savings/Public_Bank/2025-08/AI_SMART_TECH_Public_Bank_9009_2025-08-31.pdf",
    "db_transaction_count": 79,
    "verified": false,
    "pdf_transaction_count": null,
    "match_status": null,
    "notes": ""
  },
  {
    "seq": 111,
    "statement_id": 304,
    "customer_code": "CORP20251030061207",
    "bank_name": "Public Bank",
    "account_holder": "AI SMART TECH SDN. BHD.",
    "account_last4": "9009",
    "statement_date": "2025-09-30",
    "file_path": "static/uploads/customers/CORP20251030061207/savings/Public_Bank/2025-09/AI_SMART_TECH_Public_Bank_9009_2025-09-30.pdf",
    "db_transaction_count": 86,
    "verified": false,
    "pdf_transaction_count": null,
    "match_status": null,
    "notes": ""
  }
]