Company,Loan Type,Product Name,Rate,Features,Benefits,Fees & Charges,Required Documents,Tenure,Application Form URL,Product Disclosure URL,Terms & Conditions URL,Customer Preference,Source URL
HSBC,HOME_LOAN,HSBC HomeSmart,SBR-based variable rate,"Revolving facility, Deposit excess/withdraw anytime, ATM/cheque/online access","Interest on outstanding balance only","Monthly service fee: RM10, Commitment fee: RM40/month if <50% utilization, No prepayment charges","IC, payslips, property docs, SPA",Min 5 years, Max 35 years or age 70,https://www.hsbc.com.my/,https://www.hsbc.com.my/mortgages/products/homesmart/,https://www.hsbc.com.my/,Property buyers,https://www.hsbc.com.my/mortgages/products/homesmart/
HSBC,HOME_FINANCING,HSBC Amanah HomeSmart-i,Base Rate 2.63% + spread,"Shariah-compliant Diminishing Musharakah, Up to 90% margin, Zero Moving Cost promo (2025)","Prepay/withdraw anytime without charges, Takaful products available","Zero Moving Cost: Up to RM50k waived (min RM500k financing), Lock-in: 5 years","IC, payslips, property documents",Up to 35 years or age 65,https://www.hsbc.com.my/,https://www.hsbcamanah.com.my/financing/products/homesmart-i/,https://www.hsbc.com.my/,Property buyers (Islamic),https://www.hsbcamanah.com.my/financing/products/homesmart-i/
OCBC,PERSONAL_LOAN,OCBC Personal Loan,Varies by creditworthiness,"Up to RM150k, No collateral/guarantor, Fast approval","Flexible tenure","No stamping/legal fees","IC, payslips (RM2k/month min), employment letter",Up to 10 years,https://www.ocbc.com.my/,https://www.ocbc.com.my/personal-banking/loans/personal-consumption,https://www.ocbc.com.my/,Malaysian/PR permanent employment,https://www.ocbc.com.my/personal-banking/loans/personal-consumption
OCBC,PERSONAL_FINANCING,OCBC Al-Amin Personal Financing,Varies (Shariah-compliant),"Shariah-compliant, Up to RM150k, No collateral/guarantor","Islamic financing principles","No stamping/legal fees, Early settlement penalty applies (advance letter required)","IC, payslips (RM2k/month min) OR CC RM6k limit 12+ months",Up to 10 years,https://www.ocbc.com.my/,https://www.ocbc.com.my/OCBCAL_Amin/,https://www.ocbc.com.my/,Malaysian/PR,https://www.ocbc.com.my/OCBCAL_Amin/
OCBC,HOME_LOAN,OCBC Home Loan,SBR 2.75% + spread (4.70% effective for RM350k/30yr),"Up to 95% margin (with MRTA), Term/overdraft/combo options","Low base rate SBR 2.75%","Processing: Standard, Lock-in: 3 years (<RM500k), No lock-in (≥RM500k)","IC, payslips, property documents",Up to 35 years or age 70,https://www.ocbc.com.my/,https://www.ocbc.com.my/personal-banking/loans/property/home-loans,https://www.ocbc.com.my/,Property buyers (branch towns/cities only),https://www.ocbc.com.my/personal-banking/loans/property/home-loans
UOB,PERSONAL_LOAN,UOB Personal Loan,3.99-10.99% p.a. flat rate,"Up to RM150k, No guarantor/collateral, Up to RM400 cashback promo","7 business days approval, Multiple tenure options","Processing: No fee, Early settlement: 3% (min RM300), Stamp duty: Per Act, Late payment: 1%","IC, 3 months payslips, business registration (if self-employed 2 years min)",12-60 months (1-5 years),https://www.uob.com.my/,https://www.uob.com.my/web-resources/personal/pdf/personal/borrow/personal-loan/personal-loan-pds.pdf,https://www.uob.com.my/,Malaysians only age 21-55 (RM3k/month min),https://www.uob.com.my/personal/borrow/personal-loan.page
UOB,HOME_LOAN,UOB Intelligent Home Loan,SBR + spread (4.36% effective for RM350k/30yr),"Up to 95% margin (with MRTA), Flexible repayment (monthly/fortnightly/weekly/daily), Redraw facility","Payment holiday option, Interest savings with flexible frequency","Lock-in: 3 years, Early settlement: 2%, Annual facility fee: RM120 (if overdraft)","IC, payslips, property documents, SPA",Up to 35 years or age 70,https://www.uob.com.my/,https://www.uob.com.my/personal/borrow/property/i-home-loan.page,https://www.uob.com.my/,Malaysian/PR/foreigners age 18+,https://www.uob.com.my/personal/borrow/property/i-home-loan.page
UOB,HOME_LOAN,UOB Go Green Home Loan (2025 Campaign),SBR 3.00% + spread,"RM1,500 cashback upon drawdown, Up to 95% margin, For certified green properties (Gold+ category)","Environmental sustainability focus, Redraw & skip payment options","Cashback: RM1,500, Processing: Standard, Prepayment allowed","IC, payslips, property documents, green certification",Up to 35 years or age 70,https://www.uob.com.my/,https://www.uob.com.my/personal/borrow/property/go-green-home-loan.page,https://www.uob.com.my/,Green property buyers,https://www.uob.com.my/personal/borrow/property/go-green-home-loan.page
Kuwait Finance House,PERSONAL_FINANCING,KFH Personal Financing-i,Max 6.88% p.a. profit rate,"Shariah-compliant Murabahah Tawarruq, Up to RM150k or 8x salary, Salaried only","Fast approval, Islamic financing","Processing: Standard, Free personal accident insurance","IC, payslips (RM3k/month min)",2-8 years,https://www.kfh.com.my/,https://www.kfh.com.my/malaysia/personal/financing.html,https://www.kfh.com.my/,Salaried employees,https://www.kfh.com.my/malaysia/personal/financing.html
Kuwait Finance House,HOME_FINANCING,KFH Ijarah Muntahiah Bi Al-Tamlik (Completed Property),BR + 0.95% (refinancing),"Shariah-compliant lease-to-own, Up to 95% margin (with MRTT), Free moving cost (≥RM500k)","No lock-in, 20% stamp duty reduction, Possible Ibra' (rebate)","Processing: Free (≥RM500k), Late payment: 1% daily, Early settlement: 30-day notice","IC, payslips, property documents, MRTT optional",Up to 35 years or age 70,https://www.kfh.com.my/,https://www.kfh.com.my/malaysia/personal/financing.html,https://www.kfh.com.my/,Property buyers (completed properties),https://www.kfh.com.my/malaysia/personal/financing.html
Kuwait Finance House,HOME_FINANCING,KFH Ijarah Mawsufah Fi Al-Zimmah (Under Construction),Variable based on Base Rate,"Forward lease contract, Up to 95% margin (with MRTT), For under-construction properties","20% stamp duty reduction, Islamic financing","Processing: Standard, Monthly payments as rental","IC, payslips, SPA, MRTT optional",Up to 35 years or age 70,https://www.kfh.com.my/,https://www.kfh.com.my/malaysia/personal/financing.html,https://www.kfh.com.my/,Under-construction property buyers,https://www.kfh.com.my/malaysia/personal/financing.html
