Company,Loan Type,Product Name,Rate,Features,Benefits,Fees & Charges,Required Documents,Tenure,Application Form URL,Product Disclosure URL,Terms & Conditions URL,Customer Preference,Source URL
Maybank,PERSONAL_LOAN,Personal Loan,From 2.45% p.a. (EIR),"Instant approval, No collateral required, Flexible tenure","Quick cash access, Competitive rates","Processing fee: Waived, Early settlement: 1% on outstanding","IC, 3 months payslips, bank statement",1-10 years,https://www.maybank2u.com.my/,https://www.maybank2u.com.my/iwov-resources/pdf/personal/loans/personal-loan-pds.pdf,https://www.maybank2u.com.my/,Salaried employees,https://www.maybank2u.com.my/maybank2u/malaysia/en/personal/loans/personal/personal_loan.page
Maybank,HOME_LOAN,MaxiHome Loan,"SBR + spread, ~4.5% effective","Full flexi with current account, Daily interest calculation, Redraw facility","Save on interest, Flexible withdrawals","Processing: 0.5%, No lock-in period","IC, payslips, property documents, SPA",Up to 35 years or age 70,https://www.maybank2u.com.my/,https://www.maybank2u.com.my/iwov-resources/pdf/personal/loans/home-loan-pds.pdf,https://www.maybank2u.com.my/,First-time buyers & refinancing,https://www.maybank2u.com.my/maybank2u/malaysia/en/personal/loans/home/home_loan.page
Maybank,CREDIT_CARD,Maybank 2 Cards,"18% p.a. interest rate, 5% cashback","5x TreatsPoints, Cashback on groceries, petrol, dining","Lifestyle rewards, Travel insurance","Annual fee: RM180-488 (waivable), Late payment: 1%","IC, payslips, bank statement",,https://www.maybank2u.com.my/,https://www.maybank2u.com.my/iwov-resources/pdf/personal/cards/credit-cards-pds.pdf,https://www.maybank2u.com.my/,All customers,https://www.maybank2u.com.my/maybank2u/malaysia/en/personal/cards/credit_cards/index.page
CIMB Bank,PERSONAL_LOAN,CIMB Cash Plus,From 3.88% p.a. flat,"Instant approval, Up to RM200k, No guarantor","Fast disbursement, Flexible repayment","Processing: Free, Early settlement: 1% on outstanding","IC, payslips (3 months), EPF statement",1-7 years,https://www.cimb.com.my/,https://www.cimb.com.my/content/dam/cimb/personal/documents/loan-pds.pdf,https://www.cimb.com.my/,Min income RM2,500/month,https://www.cimb.com.my/en/personal/day-to-day-banking/financing/personal-financing/cimb-cash-plus.html
CIMB Bank,HOME_LOAN,CIMB Home Loan,"SBR + 0.85%, ~3.6% p.a.","Term loan or flexi options, Up to 95% financing (with MRTA)","Low rates, Flexible repayment","Lock-in: 3 years (loans <RM500k), Early settlement: 2-3%","IC, payslips, property docs, valuation report",Up to 35 years or age 70,https://www.cimb.com.my/,https://www.cimb.com.my/content/dam/cimb/personal/documents/home-loan-pds.pdf,https://www.cimb.com.my/,All property buyers,https://www.cimb.com.my/en/personal/day-to-day-banking/financing/home-financing.html
CIMB Bank,CREDIT_CARD,CIMB Platinum Mastercard,"18% p.a., 3% cash advance","10x CIMB Points, Contactless payment, Travel insurance","Rewards accumulation, Lifestyle perks","Annual fee: RM180 (waivable), Cash advance: 3%","IC, payslips",,https://www.cimb.com.my/,https://www.cimb.com.my/content/dam/cimb/personal/documents/cc-pds.pdf,https://www.cimb.com.my/,Min income RM24k/year,https://www.cimb.com.my/en/personal/day-to-day-banking/cards/credit-cards.html
Public Bank,HOME_LOAN,Public Bank Home Loan,"BR 2.40% + spread, ~4.2% effective","Term loan or semi-flexi, Up to 90% margin","Competitive rates, Fast approval","Processing: 0.5%, No early settlement penalty (after lock-in)","IC, payslips (6 months), EA form, bank statement",Up to 35 years or age 70,https://www.publicbank.com.my/,https://www.publicbank.com.my/documents/home-loan-pds.pdf,https://www.publicbank.com.my/,Malaysian citizens & PRs,https://www.publicbank.com.my/en/personal/borrow/home-loan
Public Bank,PERSONAL_LOAN,Public Bank Personal Loan,From 5.5% p.a. flat,"Up to RM150k, No collateral, Fast approval","Quick disbursement","Processing: Waived for online, Stamp duty: 0.5%","IC, payslips (3 months), bank statement",1-10 years,https://www.publicbank.com.my/,https://www.publicbank.com.my/documents/personal-loan-pds.pdf,https://www.publicbank.com.my/,Min income RM2k/month,https://www.publicbank.com.my/en/personal/borrow/personal-loan
Public Bank,CREDIT_CARD,Public Bank Visa/Mastercard,"18% p.a., 5% cash advance","Rewards points, Installment plans, Overseas acceptance","Cashback & rewards","Annual fee: RM150-488, Late payment: 1%","IC, payslips",,https://www.publicbank.com.my/,https://www.publicbank.com.my/documents/credit-card-pds.pdf,https://www.publicbank.com.my/,Min income RM24k/year,https://www.publicbank.com.my/en/personal/cards/credit-cards
RHB Bank,PERSONAL_LOAN,RHB Easy-Pay,From 3.99% p.a. flat,"Up to RM200k, Instant approval, No guarantor","Same-day disbursement","Processing: Free, Stamp duty: 0.5%, Early settlement: 1%","IC, payslips (3 months), EPF statement",1-10 years,https://www.rhbgroup.com/,https://www.rhbgroup.com/files/personal-loan-pds.pdf,https://www.rhbgroup.com/,Min income RM2k/month,https://www.rhbgroup.com/personal/loans/personal-loan.html
RHB Bank,HOME_LOAN,RHB Home Financing-i,"SBR 2.75% + spread, Islamic financing","Shariah-compliant, Up to 95% margin, Flexible tenure","Islamic principles, Competitive rates","Processing: 0.5%, Lock-in: 3-5 years","IC, payslips, property documents, valuation",Up to 35 years or age 70,https://www.rhbgroup.com/,https://www.rhbgroup.com/files/home-financing-pds.pdf,https://www.rhbgroup.com/,Muslim & non-Muslim customers,https://www.rhbgroup.com/personal/financing/home-financing.html
RHB Bank,CREDIT_CARD,RHB Visa Infinite,"18% p.a., unlimited cashback","Unlimited cashback on all spending, Airport lounge access, Travel insurance","Premium rewards, Concierge service","Annual fee: RM800, Late payment: 1%","IC, payslips, income proof (RM150k/year)",,https://www.rhbgroup.com/,https://www.rhbgroup.com/files/credit-card-pds.pdf,https://www.rhbgroup.com/,High-income earners,https://www.rhbgroup.com/personal/cards/credit-cards.html
Hong Leong Bank,PERSONAL_LOAN,HLB Personal Loan,From 4.5% p.a. flat,"Up to RM150k, No collateral, Fast processing","Flexible tenure, Competitive rates","Processing: Waived, Stamp duty: 0.5%","IC, payslips (3 months), bank statement",1-10 years,https://www.hlb.com.my/,https://www.hlb.com.my/content/dam/hlb/my/docs/pdf/personal-loan-pds.pdf,https://www.hlb.com.my/,Salaried & self-employed,https://www.hlb.com.my/en/personal-banking/loans-financing/personal-loan.html
Hong Leong Bank,HOME_LOAN,HLB Home Loan,"BR 3.33% + spread","Term or flexi options, Up to 90% margin","Low base rate, Flexible features","Processing: 0.5%, Early settlement: 3% (within 5 years)","IC, payslips, property documents",Up to 35 years or age 70,https://www.hlb.com.my/,https://www.hlb.com.my/content/dam/hlb/my/docs/pdf/home-loan-pds.pdf,https://www.hlb.com.my/,Property buyers,https://www.hlb.com.my/en/personal-banking/loans-financing/home-loan.html
Hong Leong Bank,CREDIT_CARD,HLB Wise Card,"18% p.a., 10% cashback","10% cashback (capped), Contactless payment","High cashback rate","Annual fee: RM180 (first year free), Late payment: 1%","IC, payslips",,https://www.hlb.com.my/,https://www.hlb.com.my/content/dam/hlb/my/docs/pdf/cc-pds.pdf,https://www.hlb.com.my/,Min income RM24k/year,https://www.hlb.com.my/en/personal-banking/cards/credit-cards/wise-card.html
AmBank,PERSONAL_LOAN,AmBank Personal Loan,From 4.99% p.a. flat,"Up to RM200k, Quick approval, No guarantor","Fast disbursement, Flexible repayment","Processing: Free, Stamp duty: 0.5%","IC, payslips (3 months), bank statement",1-10 years,https://www.ambank.com.my/,https://www.ambank.com.my/eng/documents/personal-loan-pds.pdf,https://www.ambank.com.my/,Min income RM2.5k/month,https://www.ambank.com.my/eng/personal/loans/personal-loan
AmBank,HOME_LOAN,AmBank Home Loan,"SBR + spread, ~4.3% effective","Term or flexi options, Up to 95% financing","Competitive rates","Processing: 0.5%, Lock-in: 3 years (loans <RM500k)","IC, payslips, property documents",Up to 35 years or age 70,https://www.ambank.com.my/,https://www.ambank.com.my/eng/documents/home-loan-pds.pdf,https://www.ambank.com.my/,Property buyers,https://www.ambank.com.my/eng/personal/property/home-loan
AmBank,CREDIT_CARD,AmBank Platinum Visa,"18% p.a., 5% cashback","5% cashback on petrol & groceries, Rewards points","Lifestyle benefits","Annual fee: RM180 (waivable), Late payment: 1%","IC, payslips",,https://www.ambank.com.my/,https://www.ambank.com.my/eng/documents/cc-pds.pdf,https://www.ambank.com.my/,Min income RM30k/year,https://www.ambank.com.my/eng/personal/cards/credit-cards
Bank Islam,PERSONAL_FINANCING,Personal Financing-i Package,From 4.38% p.a. profit rate,"Shariah-compliant, Up to RM250k, No guarantor","Islamic financing, Competitive rates","Processing: Free, Stamp duty: 0.5%, Wakalah fee: RM10","IC, payslips (3 months), EPF statement",2-10 years,https://www.bankislam.com.my/,https://www.bankislam.com.my/wp-content/uploads/PDS-Personal-Financing.pdf,https://www.bankislam.com.my/,Muslims & non-Muslims,https://www.bankislam.com.my/personal-banking/financing/personal-financing/personal-financing-i-package/
Bank Islam,HOME_FINANCING,Home Financing-i,"Profit rate based on BFR + spread","Shariah-compliant, Up to 95% margin, Flexible tenure","Islamic financing principles","Processing: Waived (promo), Lock-in: 3 years","IC, payslips, property documents, valuation",Up to 35 years or age 70,https://www.bankislam.com.my/,https://www.bankislam.com.my/wp-content/uploads/PDS-Home-Financing.pdf,https://www.bankislam.com.my/,Property buyers,https://www.bankislam.com.my/personal-banking/financing/property-financing/home-financing-i/
Bank Islam,CREDIT_CARD,Bank Islam Visa Gold Card-i,"Profit-based, Islamic card","Shariah-compliant rewards, Takaful coverage","Islamic credit solution","Annual fee: RM150 (waivable), Late payment: Ta'widh 1%","IC, payslips",,https://www.bankislam.com.my/,https://www.bankislam.com.my/wp-content/uploads/PDS-Credit-Card.pdf,https://www.bankislam.com.my/,Min income RM24k/year,https://www.bankislam.com.my/personal-banking/cards/credit-card-i/
Bank Muamalat,PERSONAL_FINANCING,Personal Financing-i,From 4.99% p.a. profit rate,"Shariah-compliant Tawarruq, Up to RM400k","Flexible financing, Islamic principles","Processing: Free, Wakalah fee: RM10, Stamp duty: 0.5%","IC, payslips (3 months), bank statement",1-15 years,https://www.muamalat.com.my/,https://www.muamalat.com.my/documents/personal-financing-pds.pdf,https://www.muamalat.com.my/,All customers,https://www.muamalat.com.my/financing/personal/personal-financing/personal-financing-i/
Bank Muamalat,HOME_FINANCING,Home Financing-i,"BFR + spread, Shariah-compliant","Islamic financing, Up to 95% margin","Competitive profit rates","Processing: Waived (promo), MRTT: Optional","IC, payslips, property docs, valuation",Up to 35 years or age 70,https://www.muamalat.com.my/,https://www.muamalat.com.my/documents/home-financing-pds.pdf,https://www.muamalat.com.my/,Property buyers,https://www.muamalat.com.my/financing/property/home-financing/home-financing-i/
Bank Rakyat,PERSONAL_FINANCING,Personal Financing-i Tawarruq,From 3.99% p.a. profit rate,"Shariah-compliant, Up to RM300k, Fast approval","Member benefits, Low rates","Processing: Free, Stamp duty: 0.5%","IC, payslips (3 months), membership proof",1-15 years,https://www.bankrakyat.com.my/,https://www.bankrakyat.com.my/documents/pf-pds.pdf,https://www.bankrakyat.com.my/,Members & non-members,https://www.bankrakyat.com.my/personal/financing/personal-financing-i-tawarruq
Bank Rakyat,HOME_FINANCING,Home Financing-i,"BFR + spread","Shariah-compliant, Up to 95% margin, Member privileges","Competitive rates, Islamic financing","Processing: 0.5%, MRTT: Optional","IC, payslips, property documents",Up to 35 years or age 70,https://www.bankrakyat.com.my/,https://www.bankrakyat.com.my/documents/hf-pds.pdf,https://www.bankrakyat.com.my/,Property buyers,https://www.bankrakyat.com.my/personal/financing/home-financing-i
BSN,PERSONAL_LOAN,BSN Personal Loan-i,From 4.5% p.a. profit rate,"Shariah-compliant, Up to RM150k","Government support, Accessible financing","Processing: Free, Stamp duty: 0.5%","IC, payslips (3 months)‬",1-10 years,https://www.mybsn.com.my/,https://www.mybsn.com.my/documents/pl-pds.pdf,https://www.mybsn.com.my/,Civil servants & public,https://www.mybsn.com.my/personal/financing/personal-loan-i
BSN,HOME_FINANCING,BSN Home Financing-i,"BFR + spread","Shariah-compliant, Government-backed, Up to 95% margin","Accessible to all Malaysians","Processing: Waived (promo)","IC, payslips, property documents",Up to 35 years or age 70,https://www.mybsn.com.my/,https://www.mybsn.com.my/documents/hf-pds.pdf,https://www.mybsn.com.my/,First-time buyers,https://www.mybsn.com.my/personal/financing/home-financing-i
SME Bank,SME_LOAN,SME Micro Financing,From 4% p.a.,"For micro SMEs, Up to RM300k, Collateral-free options","Government support, Low rates","Processing: Varies, Guarantee: CGC available","Business registration, financial statements, IC",Up to 10 years,https://www.smebank.com.my/,https://www.smebank.com.my/documents/sme-micro-pds.pdf,https://www.smebank.com.my/,Micro SMEs,https://www.smebank.com.my/products/micro-financing
SME Bank,SME_LOAN,SME Micro-i Financing,From 4% p.a. profit rate,"Shariah-compliant, For SMEs, Up to RM5 million","Islamic financing, Government-backed","Processing: Varies, Wakalah fee","Business docs, financial statements",Up to 15 years,https://www.smebank.com.my/,https://www.smebank.com.my/documents/sme-micro-i-pds.pdf,https://www.smebank.com.my/,SMEs preferring Islamic,https://www.smebank.com.my/products/micro-i-financing
EXIM Bank,BUSINESS_LOAN,Export Credit Refinancing,BLR-based competitive rates,"For exporters, Working capital & trade financing","Government support, Export facilitation","Processing: Varies by facility","Business registration, export documents, financials",Varies by facility,https://www.exim.com.my/,https://www.exim.com.my/documents/ecr-pds.pdf,https://www.exim.com.my/,Malaysian exporters,https://www.exim.com.my/products/export-credit-refinancing
Agrobank,BUSINESS_LOAN,Agro Financing,From 3.5% p.a.,"For agriculture sector, Up to RM10 million","Subsidized rates, Government-backed","Processing: Varies, Guarantee: Possible CGC","Business plan, land documents, IC",Up to 20 years,https://www.agrobank.com.my/,https://www.agrobank.com.my/documents/agro-pds.pdf,https://www.agrobank.com.my/,Agriculture businesses,https://www.agrobank.com.my/products/agro-financing
GX Bank,SAVINGS,GX FlexiCredit,3.78% p.a. interest,"Digital-first, Instant account opening, No minimum balance","High interest rate, Mobile banking","No fees, No minimum balance",,Instant access,https://www.gxbank.my/,,,Digital-savvy customers,https://www.gxbank.my/products/flexicredit
GX Bank,SAVINGS,GX Savings Account,3.0% p.a. interest,"Digital Islamic bank, Daily interest calculation","High savings rate, PIDM protected","No monthly fees, No minimum balance",,Instant access,https://www.gxbank.my/,,,All customers,https://www.gxbank.my/products/savings
Boost Bank,SAVINGS,Boost Savings Account,2.5% p.a. interest,"Digital bank, Weekly interest credit, Integrated with Boost eWallet","Seamless eWallet integration","No account fees, No minimum balance (RM1)",,Instant access,https://myboostbank.co/,,,Digital users,https://myboostbank.co/savings-account
Boost Bank,SAVINGS,Boost Savings Jars,3.0% p.a. interest,"Goal-based savings, Up to 8 jars, Auto-debit recurring deposits","Higher interest than main account","No fees",,Flexible,https://myboostbank.co/,,,Savers with goals,https://myboostbank.co/savings-account
Boost Bank,SME_LOAN,Boost SME Term Loan,From 9.9% p.a. flat,"For SMEs, RM50k-RM1M, Minimal documentation","Fast approval, No early settlement fee","Processing: Free, Early settlement: Free",Business registration (1 year min), Latest audited report,Up to 36 months,https://myboostbank.co/,,,SMEs,https://myboostbank.co/business/financing/term-loan
AEON Bank,PERSONAL_FINANCING,Personal Financing-i,6.88% p.a. profit rate,"Digital Islamic bank, Instant approval, Up to RM10k","Fast disbursement to AEON Bank account","Wakalah fee: RM1, Late payment: 1% p.a.","IC, income proof (RM3k/month min)",3-24 months,https://www.aeonbank.my/,,,Malaysian citizens 18-55,https://www.aeonbank.my/personal-financing
AEON Credit,PERSONAL_FINANCING,AEON i-Cash,From 7.92% p.a. profit rate,"Shariah-compliant, Up to RM100k, Instant to AEON Member Plus Visa","24/7 disbursement","Processing: 2-4%, Wakalah: RM10.80, Stamp duty: 0.5%","IC, income proof (RM2k/month min)",6-84 months,https://aeoncredit.com.my/,,,Min income RM2k/month,https://myaeoncredit.com.my/financing/personal-financing/
AEON Credit,CREDIT_CARD,AEON Biker Infinite Visa,"Standard CC rates, 8% cashback on bike parts & overseas","8% cashback bike-related, 2% petrol & insurance","Motorcycle community focus","Annual fees: Check with bank",,Min income: Higher tier,https://aeoncredit.com.my/,,,Motorcycle enthusiasts,https://aeoncredit.com.my/cards/credit-cards/
AEON Credit,CREDIT_CARD,AEON Platinum Visa,"Standard CC rates, 10% cashback AEON stores (20th & 28th)","6x AEON Points overseas, 6x free lounge access/year, Travel insurance up to RM1M","Premium perks, Travel benefits","Annual fee: Premium tier",,Min income: Premium tier,https://aeoncredit.com.my/,,,Premium customers,https://aeoncredit.com.my/cards/credit-cards/
Affin Bank,PERSONAL_FINANCING,Affin Islamic Personal Financing-i,3.50-5.30% p.a. nominal (6.29-6.58% EPR),"Shariah-compliant Tawarruq, No collateral/guarantor, Up to RM250k","Preferential rates for govt employees, Takaful coverage available","No processing fee, No early settlement fee, Stamp duty: 0.5%, Salary deduction: 1.5%","IC, 3 months payslips, bank statements",2-10 years (up to age 60),https://www.affinalways.com/,https://www.affinalways.com/storage/PersonalFinancing-PDS-ENG.pdf,https://www.affinalways.com/,Govt/GLC employees & salaried,https://www.affinalways.com/en/affin-islamic-personal-financing-i
Affin Bank,HOME_LOAN,Affin My First Home Scheme,SBR + spread (100% financing available),"Zero downpayment, First-time buyers only, Up to RM500k property","100% financing, Govt-backed scheme","Processing: Waived, Lock-in: 5 years, Early settlement: 2-5%","IC, payslips, property docs, SPA",Up to 35 years or age 70,https://www.affinalways.com/,https://www.affinalways.com/storage/MyFirstHome-PDS-ENG.pdf,https://www.affinalways.com/,First-time buyers 18-40,https://www.affinalways.com/en/my-first-home-scheme
Affin Bank,HOME_LOAN,Affin Home Solution Plus,SBR + spread (variable rate),"Term or flexi options, Up to 95% financing, Redraw facility","Daily rest interest calculation","Lock-in: 5 years, Early settlement: 3-5%, Processing: Standard","IC, payslips, property documents",Up to 35 years or age 75,https://www.affinalways.com/,https://www.affinalways.com/storage/HomeSolutionPlus-PDS-ENG.pdf,https://www.affinalways.com/,Property buyers,https://www.affinalways.com/en/home-solution-plus
Alliance Bank,PERSONAL_LOAN,CashFirst Personal Loan,4.99-16.68% p.a. flat (9.14-27.05% EIR),"Up to RM200k, 10 min approval, 30% cashback promo (until Dec 31, 2025)","Same-day disbursement, No processing fee","Processing: Free, Stamp duty: 0.5%, Early settlement: No penalty (3 months notice)","IC, payslips (RM3k/month min), bank statement",1-7 years (84 months max),https://www.alliancebank.com.my/,https://apply-personal-loan.alliancebank.com.my/,https://www.alliancebank.com.my/,Malaysian/PR age 21-60,https://www.alliancebank.com.my/personal/Financing/personal-loan-financing
Alliance Bank,HOME_LOAN,Alliance FlexLink Home Loan,SBR + spread,"Full flexi with current account, Deposit/withdraw anytime, Offset up to 75% of loan","No redraw fees, Interest savings","Processing: Standard, No early settlement penalty","IC, payslips, property documents",Up to 35 years or age 70,https://www.alliancebank.com.my/,https://www.alliancebank.com.my/personal/Financing/personal-mortgage/Alliance-FlexLink-Home-Loan,https://www.alliancebank.com.my/,Property buyers,https://www.alliancebank.com.my/personal/Financing/personal-mortgage/Alliance-FlexLink-Home-Loan
Alliance Bank,HOME_LOAN,Alliance ONE Account,Up to 95% margin (refinancing/consolidation),"Refinance + consolidate debts, Cash-out from equity, Optional overdraft","Debt consolidation solution","Processing: Standard","IC, payslips, property documents",Up to 35 years,https://www.alliancebank.com.my/,https://www.alliancebank.com.my/Personal/Financing/personal-mortgage/Alliance-One-Account,https://www.alliancebank.com.my/,Refinancing customers,https://www.alliancebank.com.my/Personal/Financing/personal-mortgage/Alliance-One-Account
Al Rajhi Bank,PERSONAL_FINANCING,Al Rajhi Personal Financing-i,5.27-14.83% p.a. profit rate (tiered by income),"Shariah-compliant, Up to RM250k or 8-9x salary, No collateral/guarantor","RM500 cash gift for every 5th approval (July 2025 promo), Fast 24-48 hour processing","No processing fee, No early settlement fee, Stamp duty: 0.5%","IC, 3 months payslips, 6 months bank statement, EPF statements",24-96 months (2-8 years),https://www.alrajhibank.com.my/,https://www.alrajhibank.com.my/personal/financing/personal-financing-i,https://www.alrajhibank.com.my/,Min income RM5k/month age 25+,https://www.alrajhibank.com.my/personal/financing/personal-financing-i
Al Rajhi Bank,HOME_FINANCING,Al Rajhi Home Financing-i,Variable based on Islamic Base Rate,"Shariah-compliant Commodity Murabahah, High margin available, Fixed monthly instalments","Islamic financing principles, Contracted Profit Rate ceiling","Processing: Standard, Stamp duty: 20% reduction","IC, payslips, SPA, title deed, valuation report, EPF, EA form",Up to 35 years or age 70,https://www.alrajhibank.com.my/,https://www.alrajhibank.com.my/personal/financing/home-financing-i,https://www.alrajhibank.com.my/,Malaysian citizens age 21+,https://www.alrajhibank.com.my/personal/financing/home-financing-i
MBSB Bank,PERSONAL_FINANCING,MBSB Mumtaz-i (Govt),SBR + 3.05% (5.80% EPR at SBR 2.75%),"For permanent govt/GLC employees, Up to RM250k, No guarantor","Zero processing fee, No early settlement charges, Takaful coverage optional","Processing: Zero, Early settlement: No charges, Ceiling rate: 15%","IC, 3 months payslips, bank statements",2-10 years (up to age 60),https://www.mbsbbank.com/,https://www.mbsbbank.com/consumer-banking/financing/personal-financing-i,https://www.mbsbbank.com/,Permanent govt/GLC employees RM3k+ income,https://www.mbsbbank.com/consumer-banking/financing/personal-financing-i
MBSB Bank,PERSONAL_FINANCING,MBSB Afdhal-i,SBR + 4.25% (7.25% EPR),"For contract govt/GLC & premium customers, Up to RM400k, No guarantor","Higher financing amount, Flexible for contract staff","Processing: Zero, Ceiling rate: 15%","IC, payslips, contract documents",2-10 years (up to age 60),https://www.mbsbbank.com/,https://www.mbsbbank.com/consumer-banking/financing/personal-financing-i,https://www.mbsbbank.com/,Contract govt/premium customers,https://www.mbsbbank.com/consumer-banking/financing/personal-financing-i
MBSB Bank,HOME_FINANCING,MBSB Standard Home Financing-i,Variable (ceiling 11% p.a.),"100% financing for first-time buyers RM100k-RM500k property, Legal/valuation subsidy up to RM6k","No processing fee, Special rates for first home","Processing: Waived, Legal/valuation: Subsidy up to RM6k","IC, payslips (joint applicants allowed), property documents",Up to 35 years or age 70,https://www.mbsbbank.com/,https://www.mbsbbank.com/consumer-banking/financing/property-financing-i,https://www.mbsbbank.com/,First-time buyers RM4k+ joint income,https://www.mbsbbank.com/consumer-banking/financing/property-financing-i
MBSB Bank,HOME_FINANCING,MBSB Ultimate Home Financing-i,Up to 100% margin,"For RM500k-RM10M properties, Residential & commercial, No income cap","Zero processing fee, No age restrictions (18-40)","Processing: Zero","IC, payslips, property documents",Up to 35 years or age 70,https://www.mbsbbank.com/,https://www.mbsbbank.com/consumer-banking/financing/property-financing-i,https://www.mbsbbank.com/,Higher-value property buyers,https://www.mbsbbank.com/consumer-banking/financing/property-financing-i
Standard Chartered,PERSONAL_LOAN,CashOne Personal Loan,9% p.a. flat (0.583% per month),"Up to 4x monthly salary (RM50k max), No processing fees, Up to 5 years free CC annual fees","Quick approval, No collateral/guarantor","Processing: No fees, Early settlement: No fees, Late payment: 1% p.a.","IC, payslips (RM2k/month min), bank statement",12-60 months (24 min if <RM15k),https://www.sc.com/my/,https://www.sc.com/my/loans/personal-loans/,https://www.sc.com/my/,Malaysian/foreigners age 21-65,https://www.sc.com/my/loans/personal-loans/
Standard Chartered,HOME_LOAN,MortgageOne,SBR + spread (~2.95% effective for RM900k),"Full flexi with current account, 70% deposits offset interest, Redraw facility anytime","Daily net balance interest calculation, No lock-in period","Processing: 0.5-1%, Cancellation: 0.5-2.25%, Utilisation fee: 1% p.a. if ≤30% used","IC, payslips, property documents, SPA",5-35 years or age 70,https://www.sc.com/my/,https://www.sc.com/my/loans/mortgageone/,https://www.sc.com/my/,Salaried/self-employed age 21-70,https://www.sc.com/my/loans/mortgageone/
HSBC,PERSONAL_FINANCING,HSBC Amanah Personal Financing-i,8.75% p.a. flat rate,"Shariah-compliant, Up to RM150k, Instant cash upon approval, Existing customers only","Islamic financing principles","No stamp duty, No processing fee, No early settlement fee, Late payment: 1% p.a.","IC, payslips (RM3k/month min), existing HSBC account",Flexible tenure,https://www.hsbc.com.my/,https://www.hsbcamanah.com.my/financing/products/personal-financing-i/,https://www.hsbc.com.my/,Existing HSBC customers age 21-60,https://www.hsbcamanah.com.my/financing/products/personal-financing-i/
